{
  "schema_version": "1.0.0",
  "record_type": "codex_job",
  "id": "self-healing-agent-run-recovery-self-healing-candidate-revision-senolytics-bone-rct-extraction-refresh-2026-06-21",
  "name": "Self-healing repair: agent-run-recovery-self-healing-candidate-revision-senolytics-bone-rct-extraction-refresh-2026-06-21",
  "summary": "The target senolytics-bone-rct-extraction-refresh-2026-06-21 candidate still has open major review findings in extraction_fidelity and safety_limitations; this bounded repair only aligns lifecycle state and creates a repair candidate.",
  "lifecycle_status": "ready",
  "agent_role": "self_healing_agent",
  "mode": "agent_directed",
  "prompt_file": "docs/prompts/codex-agents/self-healing-repair.md",
  "output_path": "research/agent-runs/self-healing-agent-run-recovery-self-healing-candidate-revision-senolytics-bone-rct-extraction-refresh-2026-06-21.json",
  "jsonl_log_path": "research/agent-runs/logs/self-healing-agent-run-recovery-self-healing-candidate-revision-senolytics-bone-rct-extraction-refresh-2026-06-21.jsonl",
  "scope": {
    "question": "agent_run_recovery: The target senolytics-bone-rct-extraction-refresh-2026-06-21 candidate still has open major review findings in extraction_fidelity and safety_limitations; this bounded repair only aligns lifecycle state and creates a repair candidate.",
    "hallmark_ids": [
      "cellular_senescence",
      "chronic_inflammation",
      "stem_cell_exhaustion"
    ],
    "track_ids": [
      "senolytics"
    ],
    "intervention_ids": []
  },
  "execution": {
    "isolation": "git_worktree",
    "sandbox": "workspace-write",
    "approval_policy": "never",
    "output_schema_path": "schemas/agent-run.codex-output.schema.json",
    "timeout_ms": 1800000,
    "no_output_timeout_ms": 300000
  },
  "expected_outputs": {
    "canonical_write_policy": "candidate_change_required",
    "candidate_change_id": "agent-run-recovery-self-healing-candidate-revision-senolytics-bone-rct-extraction-refresh-2026-06-21-repair",
    "required_review_lanes": []
  },
  "orchestration": {
    "read_sets": [
      "path:ops/triage-state.v1.json",
      "path:research/agent-runs/self-healing-candidate-revision-senolytics-bone-rct-extraction-refresh-2026-06-21.json",
      "triage_job:agent-run-recovery-self-healing-candidate-revision-senolytics-bone-rct-extraction-refresh-2026-06-21"
    ],
    "write_sets": [
      "candidate_change:agent-run-recovery-self-healing-candidate-revision-senolytics-bone-rct-extraction-refresh-2026-06-21-repair",
      "path:data/candidate-changes/agent-run-recovery-self-healing-candidate-revision-senolytics-bone-rct-extraction-refresh-2026-06-21-repair.json",
      "path:research/agent-runs/self-healing-candidate-revision-senolytics-bone-rct-extraction-refresh-2026-06-21.json",
      "target_record:agent_run/self-healing-candidate-revision-senolytics-bone-rct-extraction-refresh-2026-06-21"
    ],
    "conflict_keys": [
      "candidate_change:agent-run-recovery-self-healing-candidate-revision-senolytics-bone-rct-extraction-refresh-2026-06-21-repair",
      "target_record:agent_run/self-healing-candidate-revision-senolytics-bone-rct-extraction-refresh-2026-06-21",
      "triage_job:agent-run-recovery-self-healing-candidate-revision-senolytics-bone-rct-extraction-refresh-2026-06-21"
    ],
    "parallel_group": "agent-run-recovery",
    "reconciliation_required": true,
    "expected_cost": {
      "cost_class": "medium",
      "expected_wall_time_ms": 1800000,
      "expected_token_budget": 60000,
      "io_intensity": "medium"
    }
  },
  "post_run": {
    "export_latest": true,
    "verify_knowledge_base": true
  },
  "quality_gates": [
    "validate_records",
    "audit_references",
    "audit_exports",
    "audit_agent_schemas",
    "audit_agentic_process",
    "worker_output_contract",
    "candidate_agent_run_ledger_match"
  ],
  "notes": [
    "Generated from ops/triage-state.v1.json recommended_jobs[] item agent-run-recovery-self-healing-candidate-revision-senolytics-bone-rct-extraction-refresh-2026-06-21.",
    "Source queue: agent_run_status.",
    "The worker should keep edits bounded to the target record, listed inputs, and the candidate repair ledger."
  ]
}
