{
  "schema_version": "1.0.0",
  "record_type": "codex_job",
  "id": "self-healing-agent-run-recovery-self-healing-coverage-gap-senolytics-exact-effect-extraction",
  "name": "Self-healing repair: agent-run-recovery-self-healing-coverage-gap-senolytics-exact-effect-extraction",
  "summary": "Durable PubMed/PMC source snapshots were not created for DKD, IPF, or AD-risk, so the updated records are PubMed abstract-located and remain below source-snapshot-backed extraction grade. The legacy IPF generic outcome/result records still need full article reconciliation; this worker added a separate abstract-located dosing-completion result and corrected the study sample size. The D+Q bone full publication tables and supplements remain unreconciled in this bounded pass. Full npm run verify:knowledge-base did not complete because audit:worktree-helper timed out, although npm run verify:knowledge-base:post-run passed.",
  "lifecycle_status": "ready",
  "agent_role": "self_healing_agent",
  "mode": "agent_directed",
  "prompt_file": "docs/prompts/codex-agents/self-healing-repair.md",
  "output_path": "research/agent-runs/self-healing-agent-run-recovery-self-healing-coverage-gap-senolytics-exact-effect-extraction.json",
  "jsonl_log_path": "research/agent-runs/logs/self-healing-agent-run-recovery-self-healing-coverage-gap-senolytics-exact-effect-extraction.jsonl",
  "scope": {
    "question": "agent_run_recovery: Durable PubMed/PMC source snapshots were not created for DKD, IPF, or AD-risk, so the updated records are PubMed abstract-located and remain below source-snapshot-backed extraction grade. The legacy IPF generic outcome/result records still need full article reconciliation; this worker added a separate abstract-located dosing-completion result and corrected the study sample size. The D+Q bone full publication tables and supplements remain unreconciled in this bounded pass. Full npm run verify:knowledge-base did not complete because audit:worktree-helper timed out, although npm run verify:knowledge-base:post-run passed.",
    "hallmark_ids": [
      "cellular_senescence"
    ],
    "track_ids": [
      "senolytics"
    ],
    "intervention_ids": []
  },
  "execution": {
    "isolation": "git_worktree",
    "sandbox": "workspace-write",
    "approval_policy": "never",
    "output_schema_path": "schemas/agent-run.codex-output.schema.json",
    "timeout_ms": 1800000,
    "no_output_timeout_ms": 300000
  },
  "expected_outputs": {
    "canonical_write_policy": "candidate_change_required",
    "candidate_change_id": "agent-run-recovery-self-healing-coverage-gap-senolytics-exact-effect-extraction-repair",
    "required_review_lanes": []
  },
  "orchestration": {
    "read_sets": [
      "path:ops/triage-state.v1.json",
      "path:research/agent-runs/self-healing-coverage-gap-senolytics-exact-effect-extraction.json",
      "triage_job:agent-run-recovery-self-healing-coverage-gap-senolytics-exact-effect-extraction"
    ],
    "write_sets": [
      "candidate_change:agent-run-recovery-self-healing-coverage-gap-senolytics-exact-effect-extraction-repair",
      "path:data/candidate-changes/agent-run-recovery-self-healing-coverage-gap-senolytics-exact-effect-extraction-repair.json",
      "path:research/agent-runs/self-healing-coverage-gap-senolytics-exact-effect-extraction.json",
      "target_record:agent_run/self-healing-coverage-gap-senolytics-exact-effect-extraction"
    ],
    "conflict_keys": [
      "candidate_change:agent-run-recovery-self-healing-coverage-gap-senolytics-exact-effect-extraction-repair",
      "target_record:agent_run/self-healing-coverage-gap-senolytics-exact-effect-extraction",
      "triage_job:agent-run-recovery-self-healing-coverage-gap-senolytics-exact-effect-extraction"
    ],
    "parallel_group": "agent-run-recovery",
    "reconciliation_required": true,
    "expected_cost": {
      "cost_class": "medium",
      "expected_wall_time_ms": 1800000,
      "expected_token_budget": 60000,
      "io_intensity": "medium"
    }
  },
  "post_run": {
    "export_latest": true,
    "verify_knowledge_base": true
  },
  "quality_gates": [
    "validate_records",
    "audit_references",
    "audit_exports",
    "audit_agent_schemas",
    "audit_agentic_process",
    "worker_output_contract",
    "candidate_agent_run_ledger_match"
  ],
  "notes": [
    "Generated from ops/triage-state.v1.json recommended_jobs[] item agent-run-recovery-self-healing-coverage-gap-senolytics-exact-effect-extraction.",
    "Source queue: agent_run_status.",
    "The worker should keep edits bounded to the target record, listed inputs, and the candidate repair ledger."
  ]
}
