{
  "schema_version": "1.0.0",
  "record_type": "codex_job",
  "id": "self-healing-candidate-review-senolytics-dq-bone-pmc-fulltext-extraction-2026-06-22-synthesis-boundary",
  "name": "Self-healing repair: candidate-review-senolytics-dq-bone-pmc-fulltext-extraction-2026-06-22-synthesis-boundary",
  "summary": "Required review lane is missing: synthesis_boundary.",
  "lifecycle_status": "ready",
  "agent_role": "supervisor_agent",
  "mode": "agent_directed",
  "prompt_file": "docs/prompts/codex-agents/supervisor-review.md",
  "output_path": "research/agent-runs/self-healing-candidate-review-senolytics-dq-bone-pmc-fulltext-extraction-2026-06-22-synthesis-boundary.json",
  "jsonl_log_path": "research/agent-runs/logs/self-healing-candidate-review-senolytics-dq-bone-pmc-fulltext-extraction-2026-06-22-synthesis-boundary.jsonl",
  "scope": {
    "question": "candidate_review: Required review lane is missing: synthesis_boundary.",
    "hallmark_ids": [
      "cellular_senescence",
      "stem_cell_exhaustion"
    ],
    "track_ids": [
      "senolytics"
    ],
    "intervention_ids": []
  },
  "execution": {
    "isolation": "git_worktree",
    "sandbox": "workspace-write",
    "approval_policy": "never",
    "output_schema_path": "schemas/agent-run.codex-output.schema.json",
    "timeout_ms": 3600000,
    "no_output_timeout_ms": 300000
  },
  "expected_outputs": {
    "canonical_write_policy": "candidate_change_required",
    "candidate_change_id": "candidate-review-senolytics-dq-bone-pmc-fulltext-extraction-2026-06-22-synthesis-boundary-repair",
    "required_review_lanes": [
      "synthesis_boundary"
    ]
  },
  "orchestration": {
    "read_sets": [
      "path:data/candidate-changes/senolytics-dq-bone-pmc-fulltext-extraction-2026-06-22.json",
      "path:ops/triage-state.v1.json",
      "triage_job:candidate-review-senolytics-dq-bone-pmc-fulltext-extraction-2026-06-22"
    ],
    "write_sets": [
      "candidate_change:candidate-review-senolytics-dq-bone-pmc-fulltext-extraction-2026-06-22-synthesis-boundary-repair",
      "candidate_review:senolytics-dq-bone-pmc-fulltext-extraction-2026-06-22/synthesis_boundary",
      "path:data/candidate-changes/candidate-review-senolytics-dq-bone-pmc-fulltext-extraction-2026-06-22-synthesis-boundary-repair.json"
    ],
    "conflict_keys": [
      "candidate_change:candidate-review-senolytics-dq-bone-pmc-fulltext-extraction-2026-06-22-synthesis-boundary-repair",
      "candidate_review:senolytics-dq-bone-pmc-fulltext-extraction-2026-06-22/synthesis_boundary"
    ],
    "parallel_group": "candidate-review",
    "reconciliation_required": false,
    "expected_cost": {
      "cost_class": "high",
      "expected_wall_time_ms": 3600000,
      "expected_token_budget": 100000,
      "io_intensity": "medium"
    }
  },
  "post_run": {
    "export_latest": true,
    "verify_knowledge_base": true
  },
  "quality_gates": [
    "validate_records",
    "audit_references",
    "audit_exports",
    "audit_agent_schemas",
    "audit_agentic_process",
    "worker_output_contract",
    "candidate_agent_run_ledger_match",
    "supervisor_review_lanes"
  ],
  "notes": [
    "Generated from ops/triage-state.v1.json recommended_jobs[] item candidate-review-senolytics-dq-bone-pmc-fulltext-extraction-2026-06-22.",
    "Source queue: candidate_readiness.",
    "Supervisor review lane: synthesis_boundary.",
    "The worker should keep edits bounded to the target record, listed inputs, and the candidate repair ledger."
  ]
}
